<?xml version="1.0" encoding="UTF-8"?>

<izvestaj_o_imunizaciji xmlns="http://www.ftn.uns.ac.rs/izvestaj-o-imunizaciji/"
    xmlns:xs="http://www.w3.org/2001/XMLSchema#"
    xmlns:xsi="http://www.w3.org/2001/XMLSchema-instance"
    xmlns:pred="http://www.ftn.uns.ac.rs/rdf/predicate/"
    xsi:schemaLocation="http://www.ftn.uns.ac.rs/izvestaj-o-imunizaciji/ izvestaj_o_imunizaciji.xsd" 
    about="http://www.ftn.uns.ac.rs/izvestaj/2021-08-01-2021-09-01">
    
    <meta_podaci>
        <period_od property="pred:obuhvata_period_od" datatype="xs:string">2021-08-01</period_od>
        <period_do property="pred:obuhvata_period_do" datatype="xs:string">2021-09-01</period_do>
        <datum_izdavanja property="pred:izdato" datatype="xs:string">2021-11-09</datum_izdavanja>
    </meta_podaci>
    
    <broj_dokumenata_o_interesovanju>2758</broj_dokumenata_o_interesovanju>
    <broj_zahteva_za_digitalni_sertifikat>453</broj_zahteva_za_digitalni_sertifikat>
    <broj_izdatih_digitalnih_sertifikata>428</broj_izdatih_digitalnih_sertifikata>
    
    <raspodela_datih_vakcina_po_rednom_broju_doze ukupno_dato="3225">
        <doza>
            <redni_broj>1</redni_broj>
            <broj_datih_doza>1789</broj_datih_doza>
        </doza>
        <doza>
            <redni_broj>2</redni_broj>
            <broj_datih_doza>1276</broj_datih_doza>
        </doza>
        <doza>
            <redni_broj>3</redni_broj>
            <broj_datih_doza>160</broj_datih_doza>
        </doza>
    </raspodela_datih_vakcina_po_rednom_broju_doze>
    
    <raspodela_datih_vakcina_po_proizvodjacima>
        <proizvodjac>
            <naziv>Pfizer, BioNTech</naziv>
            <broj_datih_doza>1625</broj_datih_doza>
        </proizvodjac>
        <proizvodjac>
            <naziv>Sinopharm</naziv>
            <broj_datih_doza>1100</broj_datih_doza>
        </proizvodjac>
        <proizvodjac>
            <naziv>Sputnik V</naziv>
            <broj_datih_doza>356</broj_datih_doza>
        </proizvodjac>
        <proizvodjac>
            <naziv>Astra Zeneca, Oxford</naziv>
            <broj_datih_doza>144</broj_datih_doza>
        </proizvodjac>
    </raspodela_datih_vakcina_po_proizvodjacima>
    
</izvestaj_o_imunizaciji>